{
  "schema": "urn:algaguard:schema:websocket:ota-status-changed:v1",
  "schemaVersion": "1.0.0",
  "eventId": "50000000-0000-4000-8000-000000000006",
  "eventType": "ota.status.changed",
  "occurredAt": "2026-07-22T08:00:07Z",
  "organizationId": "60000000-0000-4000-8000-000000000001",
  "deviceId": "20000000-0000-4000-8000-000000000001",
  "payload": {
    "releaseId": "d0000000-0000-4000-8000-000000000001",
    "status": "DOWNLOADING",
    "progressPercent": 50,
    "downloadedBytes": 524288,
    "reportedAt": "2026-07-22T08:00:07Z",
    "runningVersion": "0.1.0"
  }
}
